1,Kayak,A boat for one person,275.00,Water Sports
2,Life Jacket,Protective and fashionable,48.95,Water Sports
3,Soccer Ball,FIFA-approved size and weight,19.50,Soccer
4,Corner Flags,Give your playing field a professional touch,34.95,Soccer
5,Stadium,"Flat-packed 35,000-seat stadium",79500.00,Soccer
6,Thinking Cap,Improve your brain efficiency by 75%,16.00,Chess
7,Unsteady Chair,Secretly give your oponent a disadvantage,29.95,Chess
8,Human Chess Board,A fun game for the family,75.00,Chess
10,Bling-Bling King,"Gold-plated, diamond-studded King",1200.00,Chess
